{
    "id": "TASK-0001",
    "revision": 1,
    "title": "TODO",
    "rigor": "R1",
    "goal": "TODO",
    "motivation": "TODO",
    "scope": {
        "in": [],
        "out": []
    },
    "constraints": [],
    "acceptance": [
        {
            "id": "AC-01",
            "statement": "TODO",
            "evidence": "TODO"
        }
    ],
    "affected_modules": [],
    "base_commit": "0000000000000000000000000000000000000000",
    "risk_flags": {
        "public_api": false,
        "persistent_format": false,
        "irreversible_migration": false,
        "architecture_boundary": false,
        "concurrency": false,
        "security": false,
        "resource_lifetime": false,
        "critical_performance": false
    },
    "decision_owners": {
        "human": [],
        "agent": []
    },
    "approval_gates": [],
    "known_unknowns": []
}
